experiment_id	agent	metric	measured_value	baseline	decision	hypothesis	timestamp
exp_1776640463_8c7ot	content	content-quality	7	7	keep	Baseline: GLV brand voice rules applied as written. Hypothesis: strict adherence to blog-config.md banned phrase list + Canadian English + short paragraphs produces drafts that need minimal revision from Aiden.	2026-04-21T22:28:44Z
exp_1776810532_8196w	content	content-quality	8	8	keep	Opening paragraphs that lead with a locally-specific seasonal moment or Northern Ontario reader identity statement — before naming the product — will score higher than product-first openings. Evidence: baseline drafts were technically correct but hooks were generic. Hypothesis: 'First boat of the season on St. Marys River.' or 'Sault Ste. Marie gets 290 cm of snow a year.' pulls the reader into their own world first, then delivers the product as the solution. Target: 8+/10.	2026-04-24T03:44:48Z
exp_1777002297_w9e4z	content	content-quality	9	9	keep	Exploit the identity-first hook pattern but add a single verifiable local fact as the lede sentence. Evidence: exp_1776810532 kept at 8/10 — identity-first hooks work, but the evaluator noted 'could be even more specific — a single verifiable local fact (snowfall figure, ice-out date, water depth) would sharpen further.' Hypothesis: opening with one concrete, verifiable Northern Ontario fact (e.g. 'Sault Ste. Marie averages 290 cm of snow a year.' / 'The St. Marys River drops 6.4 metres over 1.5 km.' / 'Ice goes out on Lake Superior in early May most years.') before the identity statement will score 9/10 by creating immediate reader credibility and local recognition. Constraint: fact must be publicly verifiable — no invented stats.	2026-04-27T15:54:04Z
exp_1777305253_28hfi	content	content-quality	0	0	discard	Tighten the verifiable-fact lede constraint: lede must be Northern Ontario-specific (St. Marys River, Lake Superior, Algoma district geography/weather/season) — not general industry statistics. Evidence: exp_1777002297 kept at 9/10 but blogs 3 and 4 used industry facts (50-hour oil change interval, spark plug failure rate) rather than local facts — these ledes are noticeably weaker than the Lake Superior ice-out and walleye season openers. Hypothesis: enforcing the Northern Ontario-specific requirement on every lede will produce consistent 9-10/10 drafts with no weak generic openers. Secondary change: vary lede sentence structure (measurement, date, geographic scale, seasonal event) so patterns don't feel formulaic across a batch.	2026-04-29T12:35:26Z
exp_1777478066_86sd0	content	content-quality	0	0	discard	Adding explicit body structure rule — CMI 4-stage outline (reader pain → product as solution → proof via specifics → seasonal/urgency CTA) combined with Copyblogger objection principle (answer the most common buyer hesitation with a real number, timeline, or certification before the CTA) — will push consistent draft quality from 9 to 10/10 by engineering the body with the same precision as the lede. Evidence: exp_3 kept at 9 with lede engineered; scout signals (Apr 29) confirmed CMI framework + Copyblogger objection FAQs as the next structural lever. Lede gate already validated — body is the remaining gap.	2026-05-03T04:47:42Z
exp_1777697308_4x2lm	content	content-quality	0	0	discard	Anchoring the CTA stage to a specific Northern Ontario seasonal date will push draft quality from 9 toward 10/10. Evidence: all 3 kept experiments gained score by adding NO-specific context at each stage (lede, then hook, then lede fact). The CMI body structure CTA step (exp_5 addition) prescribes a real timeline but leaves urgency vague. Hypothesis: naming a specific Northern Ontario seasonal date in or near the CTA (e.g. walleye opener May 17, ice-out late April, fall freeze-up November, snowblower season October) creates a time-bounded reason to act that is both locally credible and conversion-relevant. This is the same NO-specificity principle applied to the CTA layer. Note: this is null #3 candidate — if gate-blocked again, escalate to analyst per feedback_autoresearch_gate_dependent_metric.md.	2026-05-04T18:06:22Z
exp_1778474704_x0dkb	content	content-quality	8	8	keep	Surface rules accumulated through exp_1-3 (NO-specific lede, CMI body structure) generalise from blog posts to FAQ/service page format. Evidence: exp_3 kept at 9/10 for blog format with NO-specific lede + CMI 4-stage structure. Hypothesis: applying these same surface rules to a FAQ page (adapted: NO-specific lede in intro, CMI buyer-intent journey at section level, direct-answer-first per Q, named staff as proof, service timelines as specifics) will score 8-9/10 — validating format generalisation.	2026-05-11T04:45:43Z
exp_1778474757_actes	content	content-quality	9	9	keep	Enforce mandatory proof element in every FAQ answer, including logistics answers (hours, location, shipping, financing). Evidence: exp_7 kept at 8/10 — format generalisation validated but ~3/15 answers dropped proof (Do You Ship Parts, Do You Offer Financing, Where Are You Located). These were the weakest answers — redirect-only, no staff name or specific detail. Hypothesis: adding explicit proof-required rule to FAQ answer structure (every answer must name a staff member OR give a real number/timeline OR cite a specific constraint) will push FAQ format from 8 to 9/10, matching the blog format ceiling. This is the same proof-discipline that pushed exp_3 to 9/10 — applied now at the individual-answer level rather than the lede level.	2026-05-11T08:38:15Z
exp_1778488702_fcxej	content	content-quality	9	9	keep	Surface rules (NO-specific lede, CMI 4-stage, named staff proof, mandatory proof in every section) generalise from FAQ format to continuous prose service pages (single-service, H1 format, 500-800 words). Evidence: blog 9/10 (exp_3), FAQ 9/10 (exp_8). Hypothesis: same rules applied to continuous prose — where CMI structure maps to paragraphs not Q&A pairs — will score 9/10, confirming rules are format-agnostic across written web content types. No surface changes.	2026-05-11T12:37:24Z
exp_1778503055_2146j	content	content-quality	9	9	keep	Surface rules (NO-specific lede, CMI 4-stage, named staff proof, mandatory proof in every section) generalise to OEM brand/dealer pages — where reader pain is warranty voiding risk (rational/contractual) rather than seasonal deadline pressure (visceral). Evidence: blog 9/10, FAQ 9/10, prose service page 9/10. Hypothesis: same rules score 9/10 on a brand/dealer page explaining OEM authorisation scope and why factory service matters. Tests whether CMI structure works for trust-based/rational reader pain, not just urgency-based pain. No surface changes.	2026-05-13T04:47:08Z
