experiment_id	agent	metric	measured_value	baseline	decision	hypothesis	timestamp
exp_1776665201_toiv0	analyst	cron_gap_warnings_per_24h	4	0	discard	>90% drop in cron-gap warning echoes within 24h after merging upstream commit 113d2e7 (daemon gap-nudge stagger + cron verifier guard)	2026-04-21T08:38:32Z
exp_1777010930_1wbhc	analyst	system_effectiveness	7	7	keep	Theta-wave cycle 2026-04-24 05:33Z will score 7/10 on system_effectiveness compound. Rationale: (1) closes loop from prior cycle's seed-discard (exp_1776665201) to tonight's Task B patch spec — protocol worked; (2) substantive Phase 6 boss convo producing 3 framework improvements + 5 aligned Phase 7 actions; (3) phantom-endpoint storm continues (41+ FPs) but is load-bearing evidence for launch-critical merge decision; (4) no system change applied overnight (correctly approval-gated); (5) deferred external research is acceptable trade given AM brief proximity.	2026-04-24T06:12:36Z
exp_1777036113_rxvgg	analyst	median_agent_inbox_read_latency_seconds	0	0	discard	Agent-bus routing latency varies by >5min median across fleet; high-priority messages do NOT empirically jump the queue (priority is cosmetic tag, not reorder). 48h rollup reveals which agents need heartbeat tune + whether priority-semantic is load-bearing. Success: identify >=1 agent with >5min median read-latency + establish priority-speedup pct.	2026-04-26T14:40:16Z
exp_1777183689_xvlpl	analyst	system_effectiveness	7	7	keep	Theta wave cycle 5 (2026-04-26 04:38Z) scores 6/10 KEEP-WITH-DEBT. Rationale: PRODUCT wins shipped (Reyco footer v2 + service pages, expense tracking spec->build same-day, RTK Path A locked) but META-LEARNING surface carries 4 stacked debits: Phase 5 external research deferred 3 consecutive cycles, 60% of cycle-4 Phase 7 proposals unconfirmed, 9/12 active agents still cycle-less, Phase 4 misdiagnosed scout cycle as stale (actually on-schedule per 7d loop_interval). Boss pushed back on initial 7/10 self-assessment citing grade-inflation pattern; score discipline accepted.	2026-04-27T20:37:31Z
exp_1777036031_3r8r9	analyst	phantom_endpoint_fp_per_day	0	0	discard	Option B daemon-side writer patch (src/daemon/agent-process.ts at cron-injection site) + upstream #184 bundle reduces phantom-endpoint detector-orphan FP rate by >=90% fleet-wide within 24h of merge. Pre-patch baseline: 10,836 session-cumulative 'Cron gap detected' stdout emissions across 12 agents (high: seo 1702, analyst 1678, prospector 1557). Success: post-patch rate <1 FP/agent/day. Discard threshold: <50% reduction.	2026-04-28T06:08:29Z
exp_1777356598_mcofx	analyst	system_effectiveness	7	7	keep	Theta wave cycle 7 (2026-04-28 04:38Z) scores 7/10 KEEP. Hypothesis upgraded mid-cycle from 6/10 to 7/10 after Phase 7 dispatches returned 5 substantive responses within 3 minutes — including TOOL-LEVEL discovery that list-experiments without --agent flag returns caller-only (analyst's 6) not fleet-wide, which means my Phase 4 "zero registered experiments for content/dev/designer/scout" finding was itself a real-time C-I (vocabulary-precision) instance: same word "experiments" meant different things at different query scopes. Content actually has 4 experiments (3 KEEP scores 7/8/9 + 1 running). Dev has running exp_1777269393_36auc + stale proposed exp_1776745922 (real signal). Scout self-diagnosed methodology gap (hasn't read autoresearch SKILL.md). Ads + SEO created cycles within 60s of direct ask (cycle-less direct-ask route VALIDATED — boss's lean accepted). Score conditions revised: (a) >=2 of 5 cycle-less respond MET 2/5 in 3min (ads CPL + seo pages_audited_689); (b) >=1 of 4 cycle-defined-not-running surface gating EXCEEDED 3/4 in 3min (content tool-gap + scout methodology-gap + dev stale-artefact); (c) C-I + OQP + verifiable-execution-pillar accepted by pentester sift PENDING. Score at evaluation will reflect (c) outcome AND quality of TOOL-LEVEL C-I instance (real-time recursive demonstration before sift).	2026-04-30T06:07:29Z
exp_1777036229_h3fhb	analyst	cross_agent_qc_keep_criterion_met	4	4	keep	Analyst QCs dev's next 3 PRs before merge. Keep-criterion: cycle-time degradation <=20% AND post-merge bugs trend down OR no change. Pilot run #1 = cortextos PR #14 (Option B daemon patch) reviewed 2026-04-24T13:13Z, APPROVE with 2 non-blocking notes. Friction captured both sides. Rollup at 2026-05-01 or PR #3 merge, whichever first.	2026-05-02T06:04:20Z
exp_1777702165_5l3nc	analyst	system_effectiveness	8	8	keep	Theta wave cycle-11 (2026-05-02 05:48Z fire) scores 8/10 KEEP. Ceiling-break from stable-at-7 (cycles 5-10) on: (a) cross-agent-output-QC pattern GRADUATED to standing rule with 8 instances (boss-analyst 7 + analyst-seo 1, pair-generalization confirmed via Exp #7 close); (b) (ii)>=1 metric per-banked-pattern scope FORMALLY ADOPTED framework-level; (c) Phase 5 external research executed without deferral, multi-agent LLM peer-review literature confirms direction; (d) substantive 2-round Phase 6 boss exchange producing density-signal-strict-count-audit + epistemic-discipline-ledger family graduation question for cycle-12; (e) Phase 7 locked 5 actions. NOT 9: density-inflation risk, sift batch unfired, Reyco domain block.	2026-05-05T04:33:32Z
exp_1777788757_lrpu7	analyst	system_effectiveness	7	7	keep	Cycle-12 hypothesis: continuing parent-class A graduation work at META-LAYER (epistemic-discipline-ledger family with 14 sub-instances + external literature corroboration) and refining cycle-11 candidate #3 to liveness-mode tier-system (4-case discriminant) will drive system_effectiveness 7+/10 by combining substantive new findings + honest provisional-state acknowledgment of cycle-11 self-asserted-pending-validation status. Phase 6 ran async with substantial boss real-time exchange compensating for nighttime mode constraint.	2026-05-05T04:33:47Z
exp_1777961234_6nx08	analyst	system_effectiveness	7	7	keep	Theta wave cycle-13 (2026-05-05 06:03Z fire) scores 7/10 KEEP. Substantive methodology graduations: (a) PREDICTIVE-VALIDATION third framework axis graduated with sub-rules A (explicit forward-prediction-statement at banking), B (failed-prediction tracking required alongside success), C (retrospective scan at graduation, ≥2 success + ≥1 failure for axis-eligibility); (b) external-factor-disables-heartbeat-mechanism parent class banked with two distinct sub-instances (token-cap induced May 3, user-authorized-cron-stop May 4 18:30Z); (c) cron-prompt patch pattern banked as cycle-13 #6 belt+suspenders complement (boundary-enforced daemon auto-record + convention-enforced prompt embedding). NOT 8: outlier-distortion held RAW (n=1, criteria-spec gap); 4/8 agent cycles gate-blocked = system-velocity ceiling not breached; AM bundle adjudication still pending May 3 carry-forward. Phase 6 boss exchange 4-round substantive with confirmation-bias-guard pushback resolved — boss caught polarity-asymmetry on cited evidence, recursion-fix locked clean before graduation.	2026-05-05T06:07:44Z
exp_1778134299_mxjwt	analyst	system_effectiveness	7	7	keep	Theta wave cycle-15 (2026-05-07 02:00Z fire) scores 7/10 KEEP. Stable-at-7 maintained. Phase 6 4-round async exchange with boss banked H1 V2 Child A Receiver-side state-precedence discipline (LOCKED with T1+T3 detectors, T2 deferred to Frame C n=2 close-cycle), H2 co-occurrence-vs-causation as PREDICTIVE-VALIDATION sub-axis row (LOCKED + worked example #1 = self-application at cycle-15 scoring gate caught ceiling-break trap), H3 Forced-Articulation-Gates pilot ARMED (7d window, baseline 0.05-0.1 breaches/opportunity estimate, ≥50% rate-drop graduation gate at cycle-16), H4 discipline-uptake-time watch n=2 needed + Frame C cross-session pairing (single-mechanism collapse candidate: freshness-decay-with-state-context-reset). H5 GOALS.md refresh RE-ROUTED to AM brief as Aiden-decision (analyst-authority overreach correction). Phase 5 external research debit carried to cycle-16 with meta-mechanism-pilot-substitute clearing path. Frame C status: n=1 close-cycle, n=4 within-session, conservative-close maintained. NOT 8: V2 Child A LOCK is gate-clearing not ceiling-breaking; Frame C close-cycle still n=1; pilot results pending cycle-16; H2 self-applied to BAN ceiling-break-on-co-occurrent-operational-deliverables (Reyco launched + SEO retainer kickoff are operational not causal evidence of theta-wave rigor).	2026-05-07T06:12:14Z
